{
  "$schema": "https://json-schema.org/draft/2020-12/schema",
  "$id": "https://aoa.local/aoa-evals/schemas/governance_verdict_bundle_v1.json",
  "title": "Governance Verdict Bundle V1",
  "type": "object",
  "additionalProperties": false,
  "required": [
    "authority",
    "checks",
    "created_at",
    "decision_refs",
    "evidence_refs",
    "id",
    "kind",
    "notes",
    "schema_version",
    "status",
    "verdict"
  ],
  "properties": {
    "authority": {
      "type": "object",
      "additionalProperties": false,
      "required": [
        "actor",
        "mode"
      ],
      "properties": {
        "actor": {
          "type": "string",
          "minLength": 1
        },
        "mode": {
          "type": "string",
          "minLength": 1,
          "enum": [
            "reviewed"
          ]
        }
      }
    },
    "checks": {
      "type": "array",
      "items": {
        "type": "string",
        "minLength": 1
      },
      "minItems": 1
    },
    "created_at": {
      "type": "string",
      "minLength": 1
    },
    "decision_refs": {
      "type": "array",
      "items": {
        "type": "string",
        "minLength": 1
      }
    },
    "evidence_refs": {
      "type": "array",
      "items": {
        "type": "string",
        "minLength": 1
      },
      "minItems": 1
    },
    "id": {
      "type": "string",
      "minLength": 1
    },
    "kind": {
      "type": "string",
      "minLength": 1,
      "const": "eval.governance_verdict_bundle"
    },
    "notes": {
      "type": "array",
      "items": {
        "type": "string",
        "minLength": 1
      },
      "minItems": 1
    },
    "schema_version": {
      "type": "string",
      "minLength": 1,
      "const": "v1"
    },
    "status": {
      "type": "string",
      "minLength": 1,
      "enum": [
        "proposed"
      ]
    },
    "verdict": {
      "type": "string",
      "minLength": 1,
      "enum": [
        "valid"
      ]
    }
  }
}
