{
  "authority": {
    "actor": "operator.sovereign",
    "mode": "reviewed"
  },
  "checks": [
    "authority",
    "quorum",
    "evidence"
  ],
  "created_at": "2026-04-22T12:00:00-06:00",
  "decision_refs": [],
  "evidence_refs": [
    "receipt:example:001"
  ],
  "id": "eval.governance_verdict_bundle.example.001",
  "kind": "eval.governance_verdict_bundle",
  "notes": [
    "seed example for v0.8 polis governance"
  ],
  "schema_version": "v1",
  "status": "proposed",
  "verdict": "valid"
}
